[
  {
    "id": "baseline",
    "label": "Baseline — faithful consolidation",
    "axis": "baseline",
    "wcag_min_ratio": 5.21,
    "tokens": {
      "palette": [
        {"hex": "#ffffff", "role": "bg"},
        {"hex": "#111111", "role": "text"},
        {"hex": "#1a73e8", "role": "primary"}
      ],
      "type_scale": [{"px": 14}, {"px": 16}],
      "spacing": [{"px": 8}, {"px": 16}],
      "radii": [{"px": 4}],
      "shadows": [{"value": "0 1px 3px rgba(0,0,0,0.2)"}]
    },
    "design_md": "# Baseline\n\nBase design system."
  },
  {
    "id": "minimal",
    "label": "Minimal — reduced decoration",
    "axis": "minimal",
    "wcag_min_ratio": 4.80,
    "tokens": {
      "palette": [
        {"hex": "#ffffff", "role": "bg"},
        {"hex": "#333333", "role": "text"},
        {"hex": "#888888", "role": "primary"}
      ],
      "type_scale": [{"px": 14}, {"px": 16}],
      "spacing": [{"px": 8}, {"px": 16}],
      "radii": [{"px": 4}],
      "shadows": []
    },
    "design_md": "# Minimal\n\nShadows removed."
  },
  {
    "id": "high-contrast",
    "label": "High-Contrast — WCAG-AA+ accessibility",
    "axis": "high-contrast",
    "wcag_min_ratio": 9.29,
    "tokens": {
      "palette": [
        {"hex": "#ffffff", "role": "bg"},
        {"hex": "#000000", "role": "text"},
        {"hex": "#0044cc", "role": "primary"}
      ],
      "type_scale": [{"px": 14}, {"px": 16}],
      "spacing": [{"px": 8}, {"px": 16}],
      "radii": [{"px": 4}],
      "shadows": [{"value": "0 2px 6px rgba(0,0,0,0.4)"}]
    },
    "design_md": "# High-Contrast\n\nPalette pushed apart."
  }
]
